<?xml version="1.0" encoding="UTF-8"?>
<AInterfaceResponse xmlns="INC"
 xmlns:xsi="http://www.w3.org/2001/XMLSchema-instance"
 xsi:schemaLocation="INC file:/C:/workspace/JMS/src/main/resources/schema/INCResponses.xsd">
    <header>
        <msgSeqID>msgSeqID0</msgSeqID>
        <HLTID>HLTID0</HLTID>
        <GID>GID0</GID>
        <batchID>batchID0</batchID>
        <additionalInfo name="name1">additionalInfo0</additionalInfo>
        <additionalInfo name="name3">additionalInfo1</additionalInfo>
    </header>
    <body>
<!--        <errorResponse>
            <RC>5000</RC>
            <description>description0</description>
            <requestType>requestType0</requestType>
            <details>details0</details>
        </errorResponse>-->
<!--        <getDynamicDataResponse>
            <MACAccount>
                <expiryDate>2006-05-04</expiryDate>
                <balance>0</balance>
                <grossBalance>0</grossBalance>
            </MACAccount>
            <subaccount>
                <subaccountName>subaccountName0</subaccountName>
                <activationDate>2006-05-04</activationDate>
                <activationTime>01:01:01.001</activationTime>
                <expiryDate>2006-05-04</expiryDate>
                <expiryTime>01:01:01.001</expiryTime>
                <balance>0</balance>
                <grossBalance>0</grossBalance>
                <multibucket>false</multibucket>
                <unit_pack>
                    <validityPeriod>50</validityPeriod>
                    <currentBalance>50</currentBalance>
                </unit_pack>
                <unit_pack>
                    <toDate>2006-05-04T18:13:51.0</toDate>
                    <fromDate>2006-05-04T18:13:51.0</fromDate>
                    <currentBalance>50</currentBalance>
                </unit_pack>
            </subaccount>
            <subaccount>
                <subaccountName>subaccountName1</subaccountName>
                <activationDate>2006-05-04</activationDate>
                <activationTime>01:01:01.001</activationTime>
                <expiryDate>2006-05-04</expiryDate>
                <expiryTime>01:01:01.001</expiryTime>
                <balance>0</balance>
                <grossBalance>0</grossBalance>
                <multibucket>false</multibucket>
                <unit_pack>
                    <validityPeriod>50</validityPeriod>
                    <currentBalance>50</currentBalance>
                </unit_pack>
                <unit_pack>
                    <validityPeriod>50</validityPeriod>
                    <currentBalance>50</currentBalance>
                </unit_pack>
            </subaccount>
            <counter>
                <counterName>counterName0</counterName>
                <currentValue>-1073741773</currentValue>
                <datePeriod>2006-05-04</datePeriod>
            </counter>
            <counter>
                <counterName>counterName1</counterName>
                <currentValue>-1073741773</currentValue>
                <datePeriod>2006-05-04</datePeriod>
            </counter>
        </getDynamicDataResponse>
-->
<!--        <batchResponse>
            <step>
                <updateMUGServiceResponse/>
            </step>
            <step>
                <createSubscriberResponse>
                    <inID>inID0</inID>
                </createSubscriberResponse>
            </step>
        </batchResponse>
-->
<!--        <removeCalendarResponse/>
-->
<!--        <updateVPABXGroupHGResponse/>
-->
<!--        <initAddMemberResponse/>-->
<!--        <initRemoveMemberResponse/>-->
<!--        <activateMemberRoamingCutOffResponse/>-->
<!--        <deactivateMemberRoamingCutOffResponse/>-->
<!--        <activateMemberSecretaryCallResponse/>-->
<!--        <deactivateMemberSecretaryCallResponse/>-->
<!--        <setMemberAclipResponse/>-->
<!--        <addFaxResponse/>-->
<!--        <removeFaxResponse/>-->
<!--        <setFaxAutodetectionResponse/>-->
<!--        <importMemberResponse/>-->
<!--        <getClientContractsResponse>
            <subscriber>
                <number>000000000</number>
                <shortNumber>shortNumber0</shortNumber>
                <type>INTERNAL</type>
                <status>FREE</status>
                <vpnFeature>false</vpnFeature>
                <vpnFmsNumber>000000000</vpnFmsNumber>
                <vpnFmsShortNumber>vpnFmsShortNumber0</vpnFmsShortNumber>
            </subscriber>
            <subscriber>
                <number>000000000</number>
                <shortNumber>shortNumber1</shortNumber>
                <type>INTERNAL</type>
                <status>FREE</status>
                <vpnFeature>false</vpnFeature>
                <vpnFmsNumber>000000000</vpnFmsNumber>
                <vpnFmsShortNumber>vpnFmsShortNumber1</vpnFmsShortNumber>
            </subscriber>
        </getClientContractsResponse>-->
<!--        <setAlertingAnnouncementResponse/>-->
<!--        <setWelcomeAnnouncementResponse/>-->
<!--        <activateScenarioResponse/>-->
<!--        <setCalendarResponse/>-->
<!--        <setFailedCallTreatmentResponse/>-->
<!--        <setVoiceMailBoxNumberResponse/>-->
<!--        <querySubscribersResponse>
            <subscriber>
                <number>000000000</number>
                <shortNumber>shortNumber2</shortNumber>
                <type>INTERNAL</type>
                <status>FREE</status>
                <vpnFeature>false</vpnFeature>
                <vpnFmsNumber>000000000</vpnFmsNumber>
                <vpnFmsShortNumber>vpnFmsShortNumber2</vpnFmsShortNumber>
            </subscriber>
            <subscriber>
                <number>000000000</number>
                <shortNumber>shortNumber3</shortNumber>
                <type>INTERNAL</type>
                <status>FREE</status>
                <vpnFeature>false</vpnFeature>
                <vpnFmsNumber>000000000</vpnFmsNumber>
                <vpnFmsShortNumber>vpnFmsShortNumber3</vpnFmsShortNumber>
            </subscriber>
        </querySubscribersResponse>-->
<!--        <getUnansweredCallsListResponse>
            <unansweredCall>
                <number>000000000</number>
                <timeConnected>2006-05-04T18:13:51.0</timeConnected>
                <duration>0</duration>
            </unansweredCall>
            <unansweredCall>
                <number>000000000</number>
                <timeConnected>2006-05-04T18:13:51.0</timeConnected>
                <duration>0</duration>
            </unansweredCall>
        </getUnansweredCallsListResponse>-->
<!--        <activateVpabxRoamingCutOffResponse/>-->
<!--        <deactivateVpabxRoamingCutOffResponse/>-->
<!--        <removeMsisdnFromAllVpabxsResponse/>-->
<!--        <sendEmailResponse/>-->
<!--        <addVpnFmsNumberResponse/>-->
<!--        <addMemberResponse/>-->
<!--        <removeMemberResponse/>-->
<!--        <activateVpabxServiceResponse/>-->
<!--        <deactivateVpabxServiceResponse/>-->
<!--        <enableVpabxServiceResponse/>-->
<!--        <disableVpabxServiceResponse/>-->
<!--        <modifyVpabxServiceResponse/>-->
<!--        <changeMemberNumberResponse/>-->
        <changeVpabxCCNNumberResponse/>
<!--        <modifyMemberResponse/>-->
<!--        <removeVpnFmsNumberResponse/>-->
<!--        <activateVpabxAclipResponse/>-->
<!--        <deactivateVpabxAclipResponse/>-->
<!--        <activateVpabxSecretaryCallResponse/>-->
<!--        <deactivateVpabxSecretaryCallResponse/>-->
<!--        <removeMemberFromAllVpabxsResponse/>-->
<!--        <removeVpabxOnlyFromDatabaseResponse/>-->
    </body>
</AInterfaceResponse>
